{
  "schemaVersion": 1,
  "artifact": "shared/eop/iers-finals2000a-dut1.v1.json",
  "canonicalization": "UTF-8 JSON.stringify(decoded quantized records)",
  "algorithm": "sha256",
  "contentSha256": "fd0889030a70f92b46f034c33f3d1c1c4b86250688fe298cd66c8968c0660d84",
  "sourceSha256": "4b828090fc94114168014b61439fa5e6ec0bdfda518075a32baffea90110954d",
  "sourceSnapshotSha256": "f2804ee95e284322eaa07492bc6e4276a456b1a0d48b60d52b5f702b0f249cf5",
  "recordCount": 19941,
  "observedCount": 19568,
  "predictedCount": 373,
  "firstMjdUtc": 41684,
  "lastMjdUtc": 61624,
  "chunkCount": 5,
  "normalizedBytes": 161283,
  "normalizedGzipBytes": 56287
}
